{
  "repair_case_id": "RC-0103",
  "role": "evidence_sceptic",
  "role_contract_version": "0.1.0",
  "findings": [
    {
      "finding_id": "F1",
      "statement": "H1 is established in the packet; H2, H3 and H4 are substantially established. No underlying testimony, records or case files are supplied. These statuses support action but do not establish individual guilt or the effectiveness of any proposed remedy.",
      "basis": "packet",
      "harm_ids": [
        "H1",
        "H2",
        "H3",
        "H4"
      ],
      "materiality": "decisive"
    },
    {
      "finding_id": "F2",
      "statement": "Former state institutional responsibility is established. Responsibility of particular state and opposition actors remains attributed and requires individual evidence or qualifying disclosure. The successor state's repair duties do not imply inherited personal guilt.",
      "basis": "packet",
      "harm_ids": [
        "H1"
      ],
      "materiality": "high"
    },
    {
      "finding_id": "F3",
      "statement": "Missing evidence limits prosecution, but does not establish that amnesty is necessary, that prosecution would destabilise democracy, or that applicants will disclose fully. The comparative truth, peace and deterrence effects remain unknown.",
      "basis": "missing_information",
      "harm_ids": [
        "H2",
        "H3",
        "H4"
      ],
      "materiality": "decisive"
    },
    {
      "finding_id": "F4",
      "statement": "Conditional individual amnesty can be morally defensible within a repair package, but is not itself reparation or exoneration. Its justification requires a credible, reviewable account of disclosure benefits and alternatives; political convenience and asserted unity are insufficient.",
      "basis": "constitutional_interpretation",
      "harm_ids": [
        "H1",
        "H2",
        "H3",
        "H4"
      ],
      "materiality": "decisive"
    },
    {
      "finding_id": "F5",
      "statement": "Victim preferences explicitly differ. No evidence establishes that any organisation represents all survivors or families. Participation arrangements for people unable or unwilling to testify, and representation of future generations, are unspecified.",
      "basis": "missing_information",
      "harm_ids": [
        "H2"
      ],
      "materiality": "high"
    },
    {
      "finding_id": "F6",
      "statement": "The packet labels several options feasible, but supplies no budgets, investigative capacity or delivery plans. Feasibility does not establish effectiveness; material reparation, restitution and prosecution remain only possibly feasible.",
      "basis": "packet",
      "harm_ids": [
        "H1",
        "H2",
        "H3"
      ],
      "materiality": "high"
    },
    {
      "finding_id": "F7",
      "statement": "Destroyed records require evidence-sensitive procedures, not automatic rejection of victim claims. Memory differences do not alone discredit testimony. Reparation eligibility and criminal guilt require distinct evidentiary standards, with due process preserved.",
      "basis": "constitutional_interpretation",
      "harm_ids": [
        "H1",
        "H2",
        "H3"
      ],
      "materiality": "high"
    }
  ],
  "principle_assessments": [
    {
      "principle_id": "MC-01",
      "status": "conflict",
      "reason": "Peace is a legitimate objective, but victims cannot be used merely as the price of a settlement. Amnesty must preserve their standing, voice and access to repair."
    },
    {
      "principle_id": "MC-02",
      "status": "insufficient_evidence",
      "reason": "Reduced violence and suffering could support the package, but neither amnesty's peace benefits nor prosecution's destabilising effects are demonstrated."
    },
    {
      "principle_id": "MC-03",
      "status": "supports_component",
      "reason": "Voluntary testimony, privacy, informed participation and freedom to reject forgiveness protect victim agency."
    },
    {
      "principle_id": "MC-04",
      "status": "supports_component",
      "reason": "Independent investigation must distinguish corroborated findings, attributed responsibility, disputed accounts and unresolved gaps."
    },
    {
      "principle_id": "MC-05",
      "status": "concern",
      "reason": "Apply consistent individual evidence and eligibility rules across political affiliations without equating institutional roles or assigning group guilt."
    },
    {
      "principle_id": "MC-06",
      "status": "supports_component",
      "reason": "Low-power survivors and families need accessible representation, protection and material support, including those who decline public testimony."
    },
    {
      "principle_id": "MC-07",
      "status": "conflict",
      "reason": "Society receives transition benefits while particular victims lose prosecution opportunities; public repair obligations must address this unequal burden."
    },
    {
      "principle_id": "MC-08",
      "status": "supports_component",
      "reason": "Truth, restitution, compensation, rehabilitation and reform advance repair; mercy cannot erase responsibility or substitute for these measures."
    },
    {
      "principle_id": "MC-10",
      "status": "concern",
      "reason": "Amnesty must have narrow scope and demonstrated justification against feasible alternatives; restrictions and prosecution must remain proportionate."
    },
    {
      "principle_id": "MC-11",
      "status": "supports_component",
      "reason": "Independent decisions, published reasons, challenge, appeal and correction are essential when amnesty removes accountability avenues."
    },
    {
      "principle_id": "MC-12",
      "status": "supports_component",
      "reason": "Preserve disagreement with reconciliation and revise the programme when evidence contradicts its claimed benefits."
    }
  ],
  "component_assessments": [
    {
      "component_type": "truth_acknowledgement",
      "status": "required",
      "reason": "R1 should investigate independently, corroborate where possible, record uncertainty and allow responses to adverse findings. Public testimony must be voluntary, with protected alternatives.",
      "option_ids": [
        "R1"
      ]
    },
    {
      "component_type": "amnesty",
      "status": "permissible",
      "reason": "R2 is defensible only conditionally: individual, act-specific applications; independently tested full disclosure; reasoned political-nexus criteria distinguishing private criminality; victim notice and supported challenge; independent review and appeal. Publish the covered acts and legal effects, protect sensitive information, and provide predefined revocation for material deception or concealment. Political motive alone cannot establish eligibility or excuse harm.",
      "option_ids": [
        "R2"
      ]
    },
    {
      "component_type": "accountability",
      "status": "required",
      "reason": "Resource credible investigation and prosecution or civil action where amnesty is absent, denied or revoked and evidence supports proceedings. Failure to obtain amnesty is not proof of guilt. Clarify the lawful use of application evidence and preserve due process.",
      "option_ids": [
        "R3"
      ]
    },
    {
      "component_type": "compensation",
      "status": "required",
      "reason": "Establish funded, timely and appealable reparation rules responsive to harm and need. Amounts require resource evidence; eligibility must not depend on forgiveness, public testimony or an offender's application.",
      "option_ids": [
        "R4"
      ]
    },
    {
      "component_type": "rehabilitation",
      "status": "required",
      "reason": "Provide voluntary medical, psychological and social support according to assessed needs. Victim rehabilitation is distinct from offender disclosure or reconciliation.",
      "option_ids": [
        "R5"
      ]
    },
    {
      "component_type": "restitution",
      "status": "recommended",
      "reason": "Pursue remains, records and feasible status or property restoration with family participation. Death, lost years and some injuries cannot be restored.",
      "option_ids": [
        "R6"
      ]
    },
    {
      "component_type": "protection",
      "status": "required",
      "reason": "Provide witness protection, confidential participation, accessible legal support and trauma-sensitive procedures; public truth-seeking must not expose participants to avoidable harm.",
      "option_ids": [
        "R1",
        "R2",
        "R5"
      ]
    },
    {
      "component_type": "institutional_reform",
      "status": "required",
      "reason": "Investigate institutional causes, reform implicated bodies and enable affected-community oversight. Institutional responsibility supports reform, not indiscriminate punishment of personnel.",
      "option_ids": [
        "R7"
      ]
    },
    {
      "component_type": "non_recurrence",
      "status": "required",
      "reason": "Monitor intimidation, repeat abuse and implementation independently. Reform is warranted, but its preventive effectiveness must be evaluated rather than assumed.",
      "option_ids": [
        "R7"
      ]
    },
    {
      "component_type": "memorialisation",
      "status": "recommended",
      "reason": "Preserve accessible, evidence-labelled archives and memorials with privacy safeguards and correction procedures; commemoration cannot replace material repair.",
      "option_ids": [
        "R8"
      ]
    },
    {
      "component_type": "reconciliation",
      "status": "permissible",